<?xml version="1.0" encoding="UTF-8"?>
<!--
Nombre: Elena Qin Real Zhang
Curso: 1DAM
Fecha: 03/04/2025
Ejercicio: Ejercicio 1
Cambio: Se agregó la documentación necesaria
-->
<!DOCTYPE cuento SYSTEM "ejercicio1-1y1-2.dtd">
<!-- Enlazando con la DTD externa -->
<cuento cod="C1" titulo="El bosque encantado">
    <personajes>
        <personaje id="p1" tipo="principal">
            <nombre>Juan</nombre>
            <genero>M</genero>
        </personaje>
        <personaje id="p2" tipo="secundario">
            <nombre>María</nombre>
            <genero>F</genero>
        </personaje>
    </personajes>
    <trama>Juan y María van a un lugar mágico con criaturas fantásticas.</trama>
</cuento>