<?xml version="1.0" encoding="UTF-8"?>
<!--
Nombre: Elena Qin Real Zhang
Curso: 1DAM
Fecha: 03/04/2025
Ejercicio: Ejercicio 1
Cambio: Se agregÃ³ la documentaciÃ³n necesaria
-->
<!DOCTYPE cuento SYSTEM "ejercicio1-1y1-2.dtd">
<!-- Enlazando con la DTD externa -->
<cuento cod="C2" titulo="La casa del terror">
    <personajes>
        <personaje id="p1" tipo="antagonista">
            <nombre>El fantasma</nombre>
            <genero>N</genero>
        </personaje>
        <personaje id="p2" tipo="principal">
            <nombre>Pedro</nombre>
            <genero>M</genero>
        </personaje>
    </personajes>
    <trama>Pedro se enfrenta a un fantasma en una casa abandonada.</trama>
</cuento>